{
  "schema": "fa3.coexistence-footprint.v1",
  "component_id": "FA3-PROVIDER-PAGEINDEX-MCP-001",
  "classification": "PROVIDER_RUNTIME",
  "risk": "P1",
  "upstream_relation": "INTEGRATES",
  "coexistence": {
    "executables": [],
    "services": [],
    "sockets": [],
    "ports": [],
    "config_paths": [],
    "data_paths": [],
    "cache_paths": [],
    "desktop_ids": [],
    "mime_types": [],
    "protocol_handlers": [],
    "env_mutations": [],
    "databases": [],
    "plugin_paths": [],
    "external_app_integrations": [
      "VectifyAI PageIndex MCP launched only from explicit FA3_PAGEINDEX_MCP_COMMAND; cloud/OAuth runtime remains external"
    ],
    "requires_upstream_uninstall": false,
    "global_environment_mutation": false,
    "claims_default_port": false
  },
  "evidence": {
    "static_status": "PASS",
    "current_host_status": "PENDING_CURRENT_HOST",
    "runtime_promotion_claim": false,
    "artifacts": [
      "canonical/providers/FA3-PROVIDER-PAGEINDEX-MCP-001.json",
      "src/fa3_pageindex_mcp_adapter.py",
      "evidence/reference/pageindex-mcp-current-host-pending.json"
    ]
  }
}
