{
  "schema": "fa3.coexistence-footprint.v1",
  "component_id": "FA3-PROVIDER-DECISION-RULES-001",
  "classification": "PROVIDER_RUNTIME",
  "risk": "P2",
  "upstream_relation": "NONE",
  "coexistence": {
    "executables": [],
    "services": [],
    "sockets": [],
    "ports": [],
    "config_paths": [],
    "data_paths": [],
    "cache_paths": [],
    "desktop_ids": [],
    "mime_types": [],
    "protocol_handlers": [],
    "env_mutations": [],
    "databases": [],
    "plugin_paths": [],
    "external_app_integrations": [],
    "requires_upstream_uninstall": false,
    "global_environment_mutation": false,
    "claims_default_port": false
  },
  "evidence": {
    "static_status": "PENDING",
    "current_host_status": "PENDING_CURRENT_HOST",
    "runtime_promotion_claim": false,
    "artifacts": [
      "canonical/providers/FA3-PROVIDER-DECISION-RULES-001.json"
    ]
  }
}
