{
  "schema": "fa3.coexistence-footprint.v1",
  "component_id": "FA3-MCP-GATEWAY-001",
  "classification": "SYSTEM_LEVEL_AUTHORITY",
  "risk": "P0",
  "upstream_relation": "REPLACES_CAPABILITY_NOT_APPLICATION",
  "coexistence": {
    "executables": [
      "bin/fa3-mcp-gateway"
    ],
    "services": [
      "fa3-mcp-gateway.service"
    ],
    "sockets": [
      "$XDG_RUNTIME_DIR/fa3/mcp-gateway.sock"
    ],
    "ports": [
      18790
    ],
    "config_paths": [
      "~/.config/fa3/"
    ],
    "data_paths": [
      "~/.local/share/fa3/mcp-gateway-runtime"
    ],
    "cache_paths": [
      "~/.cache/fa3/"
    ],
    "desktop_ids": [],
    "mime_types": [],
    "protocol_handlers": [],
    "env_mutations": [],
    "databases": [],
    "plugin_paths": [],
    "external_app_integrations": [
      "MCP providers behind FA3-AUTH-MCP-GATEWAY-001"
    ],
    "requires_upstream_uninstall": false,
    "global_environment_mutation": false,
    "claims_default_port": false
  },
  "authority_controls": {
    "authority_id": "FA3-AUTH-MCP-GATEWAY-001",
    "conflict_detection": true,
    "previous_state_capture": true,
    "controlled_mutation": true,
    "rollback": true,
    "recovery_evidence": true
  },
  "evidence": {
    "static_status": "PASS",
    "current_host_status": "PENDING_CURRENT_HOST",
    "runtime_promotion_claim": false,
    "artifacts": [
      "bin/fa3-os-mcp-agent-exposure-install",
      "evidence/collect-fa3-os-mcp-agent-exposure-current-host.py",
      "tests/test_fa3_os_mcp_agent_exposure.py"
    ]
  }
}
