{
  "schema": "fa3.coexistence-footprint.v1",
  "component_id": "FA3-PROVIDER-STABILITY-MODELSPEC-001",
  "classification": "PROVIDER_RUNTIME",
  "risk": "P2",
  "upstream_relation": "INTEGRATES",
  "coexistence": {
    "executables": [],
    "services": [],
    "sockets": [],
    "ports": [],
    "config_paths": [],
    "data_paths": [],
    "cache_paths": [],
    "desktop_ids": [],
    "mime_types": [],
    "protocol_handlers": [],
    "env_mutations": [],
    "databases": [],
    "plugin_paths": [],
    "external_app_integrations": [
      "Stability ModelSpec is schema compatibility only; no runtime installation is claimed"
    ],
    "requires_upstream_uninstall": false,
    "global_environment_mutation": false,
    "claims_default_port": false
  },
  "evidence": {
    "static_status": "PASS",
    "current_host_status": "NOT_APPLICABLE",
    "runtime_promotion_claim": false,
    "artifacts": [
      "canonical/providers/FA3-PROVIDER-STABILITY-MODELSPEC-001.json"
    ]
  }
}
