{
  "schema": "fa3.coexistence-footprint.v1",
  "component_id": "FA3-SECRET-BROKER-001",
  "classification": "SYSTEM_LEVEL_AUTHORITY",
  "risk": "P0",
  "upstream_relation": "NONE",
  "coexistence": {
    "executables": [
      "/usr/local/bin/fa3-secretctl",
      "/usr/local/bin/fa3-secrets-admin",
      "/usr/local/sbin/fa3-secret-vault-init",
      "/usr/local/sbin/fa3-secret-policyctl",
      "/usr/local/sbin/fa3-secret-vault-recovery",
      "/usr/local/sbin/fa3-secret-vault-rekey",
      "/usr/local/sbin/fa3-secrets-lifecycle",
      "/usr/local/libexec/fa3-secret-vault-mount"
    ],
    "services": [
      "fa3-secret-vault.service",
      "fa3-secret-broker.service",
      "fa3-secrets.target",
      "run-fa3-machine\\x2dstate.mount"
    ],
    "sockets": [
      "/run/fa3-secret-broker/broker.sock"
    ],
    "ports": [],
    "config_paths": [
      "/etc/fa3/secret-policy.d",
      "/etc/credstore.encrypted/fa3-machine-state-key.cred"
    ],
    "data_paths": [
      "/var/lib/fa3/state/fa3-machine-state.img",
      "/run/fa3/machine-state"
    ],
    "cache_paths": [],
    "desktop_ids": [],
    "mime_types": [],
    "protocol_handlers": [],
    "env_mutations": [],
    "databases": [
      "/run/fa3-secret-broker/audit.jsonl"
    ],
    "plugin_paths": [],
    "external_app_integrations": [
      "systemd encrypted credentials",
      "udev/udisks exclusion rule"
    ],
    "requires_upstream_uninstall": false,
    "global_environment_mutation": false,
    "claims_default_port": false
  },
  "authority_controls": {
    "authority_id": "EXISTING_FA3_SECRETS_AUTHORITY_ONLY",
    "conflict_detection": true,
    "previous_state_capture": true,
    "controlled_mutation": true,
    "rollback": true,
    "recovery_evidence": true
  },
  "evidence": {
    "static_status": "PASS",
    "current_host_status": "PASS",
    "runtime_promotion_claim": false,
    "artifacts": [
      "bin/fa3-secret-broker-install",
      "canonical/profiles/FA3-SECRET-BROKER-001.json",
      "canonical/FA3-SECRET-BROKER-RUNTIME-CONFORMANCE-001.json",
      "canonical/decisions/FA3-DEC-SECRET-BROKER-REQUALIFICATION-2026-09-24.json",
      "bin/fa3-secret-vault-recovery",
      "bin/fa3-secret-vault-rekey",
      "evidence/reference/secret-broker-current-host-2026-09-24.json",
      "deployment/secrets/fa3-secret-broker.service",
      "deployment/secrets/fa3-secret-vault.service",
      "bin/fa3-secret-broker-uninstall"
    ]
  }
}
